{
  "schema": "credential-eval/run-config/v1",
  "scanners": [
    {
      "id": "flare-redact",
      "adapter": {
        "id": "flare-redact",
        "version": "1"
      },
      "mode": "Published npm package · secrets-only (pii, generic_assignment disabled) · JavaScript engine",
      "configuration": {
        "engine": "javascript",
        "family_mapping_version": 2,
        "node": "node",
        "options": {
          "disable": [
            "pii",
            "generic_assignment"
          ],
          "includeValues": false
        },
        "package": "flare-redact",
        "package_source": "published"
      },
      "network": "disabled",
      "limits": {
        "timeout_ms": 1800000,
        "max_stdout_bytes": 268435456,
        "max_stderr_bytes": 1048576,
        "concurrency": 2
      }
    },
    {
      "id": "gitleaks",
      "adapter": {
        "id": "gitleaks",
        "version": "2"
      },
      "mode": "Directory scan · default rules",
      "configuration": {
        "arguments": [
          "dir",
          "<input-root>",
          "--no-banner",
          "--no-color",
          "--exit-code",
          "0",
          "--report-format",
          "json",
          "--report-path",
          "-"
        ],
        "binary": "gitleaks",
        "environment_rule_overrides": false,
        "family_mapping_version": 2,
        "required_version": "8.30.1",
        "rules": "default"
      },
      "network": "disabled",
      "limits": {
        "timeout_ms": 120000,
        "max_stdout_bytes": 67108864,
        "max_stderr_bytes": 1048576,
        "concurrency": 2
      }
    },
    {
      "id": "openredaction",
      "adapter": {
        "id": "openredaction",
        "version": "1"
      },
      "mode": "Published npm package · default patterns (PII enabled) · pattern coverage only",
      "configuration": {
        "family_mapping_version": 2,
        "node": "node",
        "options": {},
        "package": "@openredaction/core",
        "package_source": "published"
      },
      "network": "disabled",
      "limits": {
        "timeout_ms": 1800000,
        "max_stdout_bytes": 268435456,
        "max_stderr_bytes": 1048576,
        "concurrency": 2
      }
    },
    {
      "id": "redact-secret",
      "adapter": {
        "id": "redact-secret",
        "version": "3"
      },
      "mode": "Published npm package · default detectors",
      "configuration": {
        "detectors": "default",
        "family_mapping_version": 2,
        "node": "node",
        "package": "@redact-secret/core",
        "package_source": "published",
        "runtime": "node"
      },
      "network": "disabled",
      "limits": {
        "timeout_ms": 1800000,
        "max_stdout_bytes": 268435456,
        "max_stderr_bytes": 1048576,
        "concurrency": 2
      }
    },
    {
      "id": "trufflehog",
      "adapter": {
        "id": "trufflehog",
        "version": "2"
      },
      "mode": "Filesystem scan · verification disabled",
      "configuration": {
        "arguments": [
          "filesystem",
          "<input-root>",
          "--json",
          "--no-verification",
          "--no-update",
          "--results=verified,unknown,unverified"
        ],
        "binary": "trufflehog",
        "family_mapping_version": 2,
        "required_version": "3.97.4",
        "update": false,
        "verification": false
      },
      "network": "disabled",
      "limits": {
        "timeout_ms": 120000,
        "max_stdout_bytes": 16777216,
        "max_stderr_bytes": 1048576,
        "concurrency": 2
      }
    }
  ],
  "methods": [],
  "execution": {
    "jobs": 8
  },
  "accounting": {
    "min_denominator": 5,
    "resolved_rate_floor": {
      "default": 0.9,
      "differential": 0
    },
    "measurable_share_floor": {
      "default": 0.7,
      "policy": 0
    },
    "twin_coverage_floor": {
      "default": 0.5,
      "policy": 0
    },
    "replays": 2,
    "interval_z": 1.96,
    "interval_precision": 6
  }
}
